{
 "schema": "elder-souls/moveset@1",
 "weapon_id": "bow_kings_horn",
 "name": "The King's Horn",
 "class": "BOW",
 "weight_tier": "ranged",
 "baseline_ref": "bow_horn_sinew",
 "stance": {
  "one_hand": {
   "stamina_mult": 1,
   "motion_value_mult": 1,
   "poise_damage_mult": 1
  },
  "two_hand": {
   "stamina_mult": 1.15,
   "motion_value_mult": 1.15,
   "poise_damage_mult": 1.3,
   "exclusive_slots": []
  }
 },
 "parry_capable": false,
 "guardbreak_kind": "kick",
 "reach_m": 1.802,
 "arc_sweep_deg": 0,
 "slots": {
  "bow.draw": {
   "anim": "clip_w_bow_kings_horn_bow_draw",
   "anim_owner": "bow_kings_horn",
   "trigger": {
    "button": "heavy",
    "modifier": "tap",
    "state_window": {
     "state": "IDLE"
    }
   },
   "chains_to": null,
   "chain_index": 1,
   "startup_f": 40,
   "active_f": 4,
   "recovery_f": 33,
   "stamina": 14,
   "motion_value": 0.85,
   "poise_damage": 4,
   "root_dz_m": 0,
   "arc_sweep_deg": 0,
   "shape": "shoot",
   "hyperarmour": {
    "enabled": false
   },
   "hitbox": {
    "kind": "capsule",
    "radius_m": 0.07,
    "bone_a": "wpn_guard",
    "bone_b": "wpn_tip"
   },
   "cancels_into": [
    "dodge"
   ],
   "requires": [
    "ammo"
   ],
   "answers": [
    "RANGED",
    "CASTER",
    "AMBUSHER"
   ]
  },
  "bow.quick": {
   "anim": "clip_w_bow_kings_horn_bow_quick",
   "anim_owner": "bow_kings_horn",
   "trigger": {
    "button": "light",
    "modifier": "tap",
    "state_window": {
     "state": "IDLE"
    }
   },
   "chains_to": null,
   "chain_index": 1,
   "startup_f": 28,
   "active_f": 4,
   "recovery_f": 26,
   "stamina": 11,
   "motion_value": 0.85,
   "poise_damage": 4,
   "root_dz_m": 0,
   "arc_sweep_deg": 0,
   "shape": "shoot",
   "hyperarmour": {
    "enabled": false
   },
   "hitbox": {
    "kind": "capsule",
    "radius_m": 0.07,
    "bone_a": "wpn_guard",
    "bone_b": "wpn_tip"
   },
   "cancels_into": [
    "dodge"
   ],
   "requires": [
    "ammo"
   ],
   "answers": [
    "RANGED",
    "SWARM"
   ]
  },
  "bow.aimed": {
   "anim": "clip_w_bow_kings_horn_bow_aimed",
   "anim_owner": "bow_kings_horn",
   "trigger": {
    "button": "heavy",
    "modifier": "hold",
    "state_window": {
     "state": "IDLE"
    }
   },
   "chains_to": null,
   "chain_index": 1,
   "startup_f": 40,
   "active_f": 4,
   "recovery_f": 78,
   "charge_max_f": 90,
   "charge_ramp": {
    "motion_value_at_full": 1.3,
    "poise_damage_at_full": 1.5,
    "hyperarmour_at_full": true
   },
   "stamina": 20,
   "motion_value": 1.6,
   "poise_damage": 6,
   "root_dz_m": 0,
   "arc_sweep_deg": 0,
   "shape": "shoot",
   "hyperarmour": {
    "enabled": false
   },
   "hitbox": {
    "kind": "capsule",
    "radius_m": 0.07,
    "bone_a": "wpn_guard",
    "bone_b": "wpn_tip"
   },
   "cancels_into": [
    "dodge"
   ],
   "requires": [
    "ammo"
   ],
   "answers": [
    "CASTER",
    "RANGED",
    "ELITE"
   ]
  },
  "bow.roll": {
   "anim": "clip_w_bow_kings_horn_bow_roll",
   "anim_owner": "bow_kings_horn",
   "trigger": {
    "button": "light",
    "modifier": "none",
    "state_window": {
     "state": "ROLL",
     "from_f": 31,
     "to_f": 52
    }
   },
   "chains_to": null,
   "chain_index": 1,
   "startup_f": 6,
   "active_f": 4,
   "recovery_f": 9,
   "stamina": 10,
   "motion_value": 0.6,
   "poise_damage": 3,
   "root_dz_m": 0,
   "arc_sweep_deg": 0,
   "shape": "shoot",
   "hyperarmour": {
    "enabled": false
   },
   "hitbox": {
    "kind": "capsule",
    "radius_m": 0.07,
    "bone_a": "wpn_guard",
    "bone_b": "wpn_tip"
   },
   "cancels_into": [
    "dodge"
   ],
   "requires": [
    "ammo"
   ],
   "answers": [
    "AMBUSHER",
    "DUELIST"
   ]
  },
  "plunge": {
   "anim": "clip_w_bow_kings_horn_plunge",
   "anim_owner": "bow_kings_horn",
   "trigger": {
    "button": "light",
    "modifier": "none",
    "state_window": {
     "state": "AIRBORNE"
    }
   },
   "chains_to": null,
   "chain_index": 1,
   "startup_f": 45,
   "active_f": 6,
   "recovery_f": 44,
   "stamina": 18,
   "motion_value": 1.53,
   "poise_damage": 9,
   "root_dz_m": 0.16,
   "arc_sweep_deg": 8,
   "shape": "thrust",
   "hyperarmour": {
    "enabled": false
   },
   "hitbox": {
    "kind": "capsule",
    "radius_m": 0.07,
    "bone_a": "wpn_guard",
    "bone_b": "wpn_tip"
   },
   "cancels_into": [
    "dodge"
   ],
   "requires": [
    "airborne",
    "descending"
   ],
   "answers": [
    "AMBUSHER",
    "ELITE"
   ]
  },
  "guardbreak": {
   "anim": "clip_horn_guardbreak",
   "anim_owner": "lin_horn",
   "trigger": {
    "button": "light",
    "modifier": "forward",
    "state_window": {
     "state": "IDLE"
    }
   },
   "chains_to": null,
   "chain_index": 1,
   "startup_f": 14,
   "active_f": 6,
   "recovery_f": 18,
   "stamina": 16,
   "motion_value": 0.35,
   "poise_damage": 24,
   "root_dz_m": 0.55,
   "arc_sweep_deg": 5.3,
   "shape": "grab",
   "hyperarmour": {
    "enabled": false
   },
   "hitbox": {
    "kind": "capsule_swept",
    "radius_m": 0.07,
    "bone_a": "wpn_guard",
    "bone_b": "wpn_tip"
   },
   "cancels_into": [
    "dodge"
   ],
   "answers": [
    "TURTLE"
   ]
  },
  "art.1": {
   "anim": "clip_w_bow_kings_horn_art_1",
   "anim_owner": "bow_kings_horn",
   "trigger": {
    "button": "two_hand",
    "modifier": "hold",
    "state_window": {
     "state": "IDLE"
    }
   },
   "chains_to": null,
   "chain_index": 1,
   "startup_f": 54,
   "active_f": 6,
   "recovery_f": 52,
   "stamina": 22,
   "motion_value": 1.44,
   "poise_damage": 8,
   "root_dz_m": 1.44,
   "arc_sweep_deg": 19,
   "shape": "thrust",
   "hyperarmour": {
    "enabled": false
   },
   "hitbox": {
    "kind": "capsule",
    "radius_m": 0.07,
    "bone_a": "wpn_guard",
    "bone_b": "wpn_tip"
   },
   "cancels_into": [
    "dodge"
   ],
   "answers": [
    "ELITE",
    "GANK_DUO"
   ]
  }
 },
 "notes": "SIGNATURE. Every shot in its table is authored: the quick shot is a full draw thrown fast rather than a hip shot, which makes it the only bow whose fast option is not also its weak one.\n\nProjectile range 22.2 m (RI-WPN02 §B); reach_m above is the bow's own hitbox reach.\n\nLineage: horn — Horn and sinew. Drawn to the cheek.\nMandatory slots present: 7/7. Total slots: 7.\nart.1/art.2 trigger: the schema's trigger block cannot express a chord, so the declared button is 'two_hand' with modifier hold/double_tap. The runtime conjunction is 'heavy pressed while two_hand is HELD' (art.1) and 'heavy HELD while two_hand is HELD' (art.2) — game/data/weapons/input-map.json is authoritative and machine-readable."
}
